{
  "risk_id": "01ARZ3NDEKTSV4RRFFQ69G5FAG",
  "project_id": "01ARZ3NDEKTSV4RRFFQ69G5FAV",
  "task_id": "01ARZ3NDEKTSV4RRFFQ69G5FA2",
  "category": "schedule",
  "description": "Potential delay in data collection due to resource availability",
  "impact": "Project timeline may slip by 4 weeks",
  "likelihood": "possible",
  "risk_score": 60.0,
  "mitigation": "Begin recruiting additional research assistants now",
  "contingency": "Reduce scope of Phase 2 if necessary",
  "owner_id": "01ARZ3NDEKTSV4RRFFQ69G5FAB",
  "status": "active",
  "blocker_id": "01ARZ3NDEKTSV4RRFFQ69G5FB4",
  "created_at": "2026-04-10T11:00:00Z",
  "updated_at": "2026-04-18T13:30:00Z"
}
